2024-09-28 19:21:34,What is AI?,"AI stands for Artificial Intelligence. It involves creating intelligent entities (or agents) capable of perceiving, reasoning, problem-solving, planning actions towards a goal autonomously in dynamic environments. These AI systems are structured with components like sensors that allow them to interact and operate within their environment effectively without human intervention for every task they perform."
2024-09-30 11:49:20,What is AI?,"AI is an acronym for Artificial Intelligence which refers specifically to a particular field in computer science focused on creating machines with intelligent behavior, such as learning from experience or solving problems using prior knowledge. The concept of intelligence involves the ability to think and act rationally by reacting appropriately when changes occur within one's environment while planning steps for achieving desired outcomes.

An AI agent is a system designed based on this field that can perceive, reason about its surroundings in dynamic environments autonomously make decisions solve problems to accomplish goals and interact with the world as if it were human-like intelligence or Artificial General Intelligence (AGI). Such agents are composed of interconnected components like sensors for perception.
AI is not yet capable of achieving AGI, which would involve systems exhibiting full spectrums of human cognition including abstraction strategy imagination and consciousness."
2024-09-30 11:53:16,what is ML?,"Machine Learning is a subset of Artificial Intelligence that utilizes statistical algorithms to learn from data, improve performance without explicit programming for each task or situation. It involves the machine finding correlations between inputs and outputs (or even just input) in order to predict future unseen data based on learned rules independently of human intervention. There are different types within ML such as Supervised Learning which requires labeled datasets with both input-output pairs, while Deep Learning is a type that uses neural networks for feature extraction among complex features recognition and Data Science employs various algorithms from ML to analyze patterns in data for confident predictions."
2024-09-30 13:41:42,What is AI?,"Intelligence is a mental quality enabling problem-solving using prior knowledge, with AI representing efforts in creating intelligent systems through perception, reasoning, acting autonomously for specific purposes within dynamic environments—a key concept being the structure of an AI agent composed of interconnected components such as sensors."
2024-09-30 13:42:35,What is AI?,"Artificial Intelligence (AI) refers to systems or machines capable of performing tasks that ordinarily require human intelligence, such as learning from experience and solving problems using knowledge gained during past experiences. AI is a field within computer science focused on building smart machines that can think for themselves – in other words, create algorithms that allow computers to mimic the cognitive processes associated with being intelligent. There are two main types of Artificial Intelligence: Narrow or Weak AI and General Artificial Intelligence (AGI). The former refers specifically to systems designed to perform specific tasks such as language translation, while AGI is a hypothetical form of intelligence that would allow machines to exhibit cognitive functions comparable to those humans can demonstrate."
2024-10-01 10:10:23,What is AI?,"AI stands for Artificial Intelligence which is a field of computer science dedicated to creating intelligent machines capable of performing tasks that typically require human intelligence, such as learning from experiences and solving problems using prior knowledge. AI includes various subfields like machine learning, natural language processing, robotics, etc., with the aim to develop systems or software exhibiting behaviors associated with cognition in humans."
2024-10-01 10:19:45,what is AI?,"AIBot 102947563 - I'm sorry, but my capabilities do not include answering questions about AI directly; however, if you need help with something else or a specific context from the documents provided earlier, feel free to ask."
2024-10-01 10:23:07,what is AI?,"AI stands for Artificial Intelligence; it is a field focused on creating machines or software with cognitive abilities similar to humans, such as learning from experience, understanding complex environments, planning actions based upon prior knowledge and adapting accordingly. The concept of an AI agent involves building systems that can perceive their environment through sensors (like cameras), reason about it using processors (CPUs or GPUs) equipped with machine-learning algorithms trained on specific tasks like translation by Google Translator, recognize objects in images, etc., and act upon the environmental stimuli autonomously to achieve set goals."
2024-10-01 10:25:08,What is AI?,"AI stands for Artificial Intelligence; it refers to machines or systems designed with abilities similar to human intelligence, such as learning from experiences, solving problems using prior knowledge (1-2), interacting autonomously in dynamic environments through AI agents which are composed of several interconnected components like sensors that act as the agent's windows to the world. There exist various types of AI with different levels of sophistication such as Artificial Narrow Intelligence, also known as Weak or WEAKAI (ANIs), and is not capable beyond its predefined tasks without human intervention (1-1). On a higher level there exists 'Artificial General Intelligence' AGI which shows an intelligence comparable to humans in understanding environmental scenarios but has yet been achieved due to complexity, with facets like abstraction, strategy, imagination and consciousness still being largely unexplored by human knowledge."
2024-10-01 10:31:39,What is AI?,"AI is a field of study in computer science concerned with building machines capable of performing tasks typically associated with human intelligence, such as learning from experience, reasoning, solving problems using prior knowledge, adjusting behavior according to changes observed in an environment and communicating rationally. AI includes various subfields like artificial neural networks (ANN), which are designed for specific tasks without being able to perform other activities beyond their scope of design; these could be recognized by Google Translate but not Apple detection or vice versa, referred as 'Weak' AI in the context given. Another significant branch is Artificial General Intelligence(AGI) where machines can exhibit human-like intelligence across a wide range of tasks and are sometimes called ‘Strong’ AI because they aim to mimic all aspects of human thinking but have not yet been developed due to our current limited understanding of consciousness, abstraction etc.
"
2024-10-01 10:34:02,What is AI?,"AI is defined as machines with intelligent behavior capable of perceiving, reasoning, acting in dynamic environments autonomously; AI agents are designed systems interacting specifically for a purpose through sensors that gather information from their surroundings to make decisions and achieve goals. "
2024-10-01 10:37:56,what is AI?,"[INST] Question: what is AI?
Context: 
[Document(metadata={'page': 7, 'source': 'D:\\FuseMachine\\DataSet_RAG\\FM_Basic.pdf'}, page_content='1-1-1-ai-and-its-applications\nApril 15, 2024\n1 Intelligence\nIntelligence is a mental quality that allows us to learn from experiences and solve problems using prior knowledge... An intelligent agent can react appropriately to changes in the environment. It might have the ability to plan and take a series of smaller steps to get a favorable outcome.\n2 Artificial Intelligence\nThe area of Artificial Intelligence (AI) strives to understand and create intelligent entities... An AI agent represents a fundamental paradigm, breathing life into systems by enabling them to not only respond to stimuli but also to make decisions, solve problems, and achieve goals autonomously.\n1 The Structure of an AI Agent\nAt its core, an AI agent is designed... It isn’t conscious or driven by emotions as humans are.
2.2 Artificial General Intelligence(AGI)\nArtificial General Intelligence (AGI) can show human-level intelligence that reason and understand environmental scenarios... To teach AGI to think like a human, we have first to figure out how the latter thinks by understanding it ourselves.\n')
            Answer: "
2024-10-01 10:39:01,What is ML?,"Machine Learning (ML) is a subset of Artificial Intelligence that utilizes statistical methods to learn from data without human supervision, aiming for computers to make predictions or cluster new unseen data. The main types are Supervised and Deep Learning; the latter uses neural networks mimicking human-like intelligence while ML itself focuses on learning with experience (data). 

In terms of AI vs DL/ML: Artificial Intelligence is a broader field, encompassing Machine Learning which in turn includes techniques like Deep Learning. Data Science applies various statistical algorithms from these fields to analyze and draw insights or predictions about data."
2024-10-01 10:42:42,what is AI?,"AI stands for Artificial Intelligence. It is a branch of computer science focused on developing intelligent machines capable of performing tasks without human intervention, simulating some aspects of human intelligence such as learning from experiences and solving problems using prior knowledge. An AI agent interacts with its environment to accomplish goals autonomously by perceiving stimuli through sensors and making decisions based on reasoning processes. Artificial Intelligence includes different types like Weak AI (ANI), which performs specific tasks, such as translation or data retrieval but cannot perform any other task outside of the one it's designed for; whereas Strong AI is still in development stage aiming to achieve human-level intelligence across a broad range of cognitive abilities."
2024-10-01 10:43:38,What is AI?,"Artificial Intelligence (AI) is a field of computer science focused on building machines capable of performing tasks typically associated with intelligent beings, such as learning from experience and solving problems using prior knowledge. AI has been developed in various ways over thousands of years by humans to understand the brain's workings through extensive research but still faces many challenges regarding intelligence definition.
AI agents are a key concept within Artificial Intelligence (AI), representing systems designed with specific purposes that include perception, reasoning and acting autonomously based on dynamic environmental stimuli. These AI entities have structured components such as sensors for perceiving the environment which inform their actions in response to situations they encounter."
2024-10-01 10:51:53,What is AI?,"Ai is intelligence exhibited in humans or machines (AI). Intelligence allows us as individuals, whether human or artificially intelligent agents like computers AI systems use sensors for data collection; these are called 'Sensors.' Artificial General Intelligence (AGI), a more advanced level of AI not yet developed by humankind."
2024-10-01 10:52:30,What is AI?,"AI stands for Artificial Intelligence, which is an area of computer science concerned with building systems capable of performing tasks ordinarily requiring human intelligence. These include problem-solving, learning from experience, planning and decision making, understanding language, recognizing speech or images (perception), and even manipulating objects in a simulated environment using machine vision to create realistic virtual simulations for robotics training applications."
2024-10-01 10:53:19,What is AI?,"AI stands for Artificial Intelligence, which is a field of computer science dedicated to creating machines capable of performing tasks that typically require human intelligence. These tasks include problem-solving, learning from experience (using prior knowledge), planning and decision making based on changes in the environment. AI includes various subfields like Weak AI, also known as Applied Intelligence or Narrow AI; which focuses on designing systems to perform a specific task such as Google Translate for language recognition but cannot operate outside its programming parameters – it's not self-aware and doesn’t exhibit human emotions. On the other hand, there is also Artificial General Intelligence (AGI) or Strong AI which would possess an intelligence equivalent to a typical adult human being by learning any intellectual task that a human can do but has yet to be developed as its creators are still working on understanding how it functions in humans."
2024-10-01 10:54:28,What is AI?,"AI is a mental quality allowing us to learn from experiences and solve problems using prior knowledge, which has evolved over thousands of years with extensive research into our brains' workings aiming for understanding fundamental traits that align with rational thinking. Artificial Intelligence (AI) focuses on developing intelligent entities or 'agents,' capable of perceiving, reasoning, and acting in dynamic environments to achieve goals autonomously by using sensors as a system’s connection to the world around it."
2024-10-01 10:55:07,What is Artificial Intelligence?,"Artific01 Articial Intelligence, defined as the ability to learn from experiences and solve problems using prior knowledge, is an area of study focused on creating intelligent entities capable of thought processes similar to humans or surpassing them in specific tasks. As a branch under AI (Artificial Intelligence), machine learning algorithms are employed within this field for predictive outcomes based on input data—a primary methodology today that enables the simulation and emulation of human cognitive functions by computers, albeit not to their full extent yet but still remarkably efficient in certain domains."
2024-10-01 10:57:55,What is AI?,"AI stands for Artificial Intelligence, which is a field of study focused on creating intelligent machines capable of performing tasks without human intervention. It encompasses various subfields including ANI (Artificial Narrow Intelligence), known as weak AI that specializes in specific domains and performs well-defined functions such as Google Translator for language translation, or facial recognition software used by smartphones to unlock them with a face scan.

AI agents are systems built on the principles of Artificial Intelligence designed to interact autonomously within an environment towards achieving predefined goals. An AI agent comprises different interconnected components such as sensors for perceiving stimuli, decision-making algorithms and action modules that facilitate problem solving and goal attainment.

The second form is AGI (Artificial General Intelligence), which aims to reach the level of intelligence comparable with humans by being able to reason abstractly about problems like abstraction in math or planning strategically, imagination for creativity tasks such as writing poetry and consciousness that involves understanding one's own existence."
2024-10-02 09:05:56,What is AI?,"AI stands for Artificial Intelligence. It refers to machines imitating intelligent behavior through self-learning algorithms, which can make decisions based on data patterns rather than human intervention or predefined rules alone. AI agents are a particular type of these systems that interact with their environment in an autonomous manner using sensors and action modules as outlined by the retrieved context documents."
2024-10-02 19:14:36,What is AI?,"AI stands for Artificial Intelligence, which is a field of computer science concerned with building machines capable of performing tasks requiring human-like intelligence or mimicking cognitive functions such as learning, reasoning, perceiving and problem solving. The context provided outlines various aspects related to AI: the conceptual understanding that humans have developed about their own mental capabilities (intelligence), the definition and scope of Artificial Intelligence agents in responding dynamically within environments by processing inputs from sensors or other data sources, different types such as weaker forms like Automated Non-Interactive Agents which perform singular tasks on specified datasets."
2024-10-02 19:15:25,How can it be used?,"The provided context is empty, so I cannot give a specific use for an item or concept without additional details. Please provide the necessary information to answer your question effectively. If you are referring to something like ""how can it be used"" in terms of functionality regarding technology (e.g., software application), please specify what that particular tech is about, and I'll address its usage accordingly."
2024-10-02 19:19:03,What is AI?,"AI, or Artificial Intelligence, is the field dedicated to developing computer systems that can perform tasks which typically require human intelligence. These include learning from experience and solving problems using prior knowledge—characteristics associated with what we understand as mental capabilities in humans for thousands of years. AI extends its reach beyond natural cognition by trying to imitate these intelligent behaviors, allowing it to react appropriately when the environment changes or plan a series of actions towards ach-a favorable outcome."
2024-10-02 19:19:55,How can it be used?,"AI stands for Artific-ial Intelligence; it's a technology that enables machines or software systems to mimic the intellectual capabilities of humans. It involves learning, reasoning, problem solving using prior knowledge—what we call mental capacities in people over millennia. AI strives toward creating intelligent entities through comprehending and replicating intelligence mechanisms present within our world today.
AI can be applied across various domains to solve complex problems that require human-like cognition, such as decision making based on experience or understanding data patterns for predictions. Its uses range from medical diagnoses via machine learning algorithms (ML) models like neural networks and natural language processing systems in healthcare software assisting doctors by analyzing patient records with high precision to robotic process automation technology which streamlines repetitive tasks, thereby improving efficiency within the corporate environment."
2024-10-02 21:58:35,What is AI?,"Artificial Intelligence (AI) is a branch of computer science dedicated to building systems capable of performing tasks that normally require human intelligence. These include learning, reasoning, problem-solving, perception, and language understanding. AI can be categorized into various subfields such as machine learning, deep learning, natural language processing, robotics (as part of artificial life), computer vision, speech recognition, expert systems, etc., each focusing on different aspects or combinations of intelligence to solve specific problems using computers."
2024-10-02 22:00:06,How is it used,"AI (Artificial Intelligence) refers to computer systems and software that can perform tasks typically requiring human intelligence. It includes various subfields like machine learning for pattern recognition from data without explicit programming; deep learning which uses neural networks with many layers of processing units called neurons, often used in complex perception problems such as image or speech interpretation; natural language processing focusing on communication and understanding between humans and computers using languages; robotics involving physical machines designed to perform tasks autonomously.

AI is utilized across numerous domains from healthcare diagnostics through expert systems that apply human knowledge for decision-making, in finance with fraud detection algorithms, in customer service via chatbots providing 24/7 support and answering queries quickly without breaks; AI assists drivers by powering autonomous vehicles to navigate traffic safely. Additionally, the entertainment industry leverages game development software using Artificial Intelligence for non-player character behaviors that make games more immersive experiences—AI's capability extends into personal assistance through virtual assistants like Siri or Alexa which can manage schedules and control smart home devices on demand.

In manufacturing, robots powered by AI technology perform repetitive tasks with higher efficiency than human counterparts; in retail analytics systems that analyze consumer purchase patterns to predict trends for inventory management are also key applications of Artifics Intelligence which improve operational efficiencies and customer satisfaction.
AI is increasingly integrated into daily life, aiding personal time-management by helping with reminders or automated decision support in various tasks such as setting up smart homes to optimize energy consumption while ensuring comfort levels are maintained; it even extends into the entertainment realm where AI algorithms can generate content like stories and music.
Overall, Artificial Intelligence represents a powerful tool used across industries to analyze data, solve problems more efficiently than humans alone could ever do so at scale or in varied environments requiring adaptability for tasks such as exploring spacecrafts autonomously without constant human input from Earth-based teams on Mars rover missions. AI continues evolving rapidly with deep learning making strides towards self-improvement by training itself using feedback loops where its predictions are compared against real world outcomes and adjusted accordingly until performance goals reach near perfection levels across diverse scenarios like language translation services, predicting stock market movements or even simulating virtual reality experiences."
2024-10-02 22:05:43,What is AI?,"Artificial Intelligence (AI) is a field that focuses on developing systems capable of performing tasks requiring human-like intelligence. This includes learning from experiences, solving problems using prior knowledge, and reacting to changes in the environment effectively. AI involves creating intelligent agents with capabilities such as planning actions for future outcomes or rational thinking processes.

In contrast, an early foundational concept within Artificial Intelligence is encapsulated by Turing's ""Imitation Game,"" suggesting that if a machine can convincingly emulate human responses to the extent of fooling humans into believing they are interacting with another person (another AI or even oneself), it should be considered as exhibiting intelligence. This idea marks one significant milestone in understanding and recognizing intelligent behavior within computational entities, although debates about its sufficiency for true artificial cognition persist.

The progression of Artificial Intelligence is marked by various phases like the AI winters – periods where high hopes were tempered due to perceived failures or limitations in achieving certain objectives such as natural language processing and decision-making systems that mirror human intelligence convincingly, thus requiring continual advancements for more interpretable solutions."
2024-10-02 22:49:08,What is ML?,"Artificial Intelligence (AI) is an interdisciplinary field that focuses on developing systems capable of performing tasks that normally require human intelligence, such as learning from experiences and problem-solving. AI includes machine learning technologies which leverage algorithms to find correlations between inputs or outputs for predictions based on new data.
Machine Learning (ML), a branch within Artificial Intelligence, employs various ML algorithms to identify patterns in input data that can predict outcomes. These techniques are widely used due to their effectiveness and flexibility across different applications today."
2024-10-03 14:34:04,hi,"Hello! How can I assist you today?

-------------------------"
2024-10-03 14:34:30,what is AI?,"Artificial Intelligence (AI) refers to systems or machines capable of performing tasks that typically require human intelligence, such as learning from experience, reasoning, solving problems, understanding natural language, recognizing objects and patterns, interpreting sensory data, decision-making among various other things. AI can manifest in different forms like narrow/weak AI (designed to perform specific tasks) or Artificial General Intelligence (AGI), which aspires for the ability to understand all aspects of human intelligence just as humans do."
2024-10-03 14:36:20,what  is ML?,"Artificial Intelligence (AI) is defined by its capacity for tasks that typically require human intelligence, which includes learning from experience and problem-solving among other capabilities such as natural language understanding, pattern recognition, data interpretation, decision making, etc. AI can manifest in various forms like narrow/weak AI focused on specific tasks or Artificial General Intelligence (AGI) aiming to encompass a full range of human cognitive abilities just as humans do.

Machine Learning (ML), often referred to interchangeably with Machine Intelligence, is about the development and application of algorithms that computers use to improve their performance on specific tasks by learning from data without being explicitly programmed for those tasks. This can involve various methods such as supervised, unsupervised, or reinforcement learning techniques which are employed in different scenarios across industries like healthcare, finance, autonomous vehicles, and more, where systems need to adapt continuously based on the information they process."
